### ISSUE TITLE
udp_server.pkt script not working

### ISSUE THREAD

**Issue by tuexen** [nplab/packetdrill#131]
The `gtests/net/packetdrill/tests/bsd/udp/udp_server.pkt` script:
```
 0.000 socket(..., SOCK_DGRAM, IPPROTO_UDP) = 3
+0.000 bind(3, ..., ...) = 0
+1.000 < udp(1000)
+0.000 recvfrom(3, ..., 1000, 0, ..., ...) = 1000
+1.000 sendto(3, ..., 1000, 0, ..., ...) = 1000
+0.000 > udp(1000)
+1.000 close(3) = 0
```
does not work. In particular, the packet sent out has the wrong destination port.

**Comment by shivrai** [comment]
I tried running the UDP tests on linux and observed the following behavior -

* In `udp_server.pkt`, the call to `sendto` after `recvfrom` hangs (after injecting the inbound packet) -
  ```
  +1.000 < udp(1000)
  +0.000 recvfrom(3, ..., 1000, 0, ..., ...) = 1000
  +1.000 sendto(3, ..., 1000, 0, ..., ...) = 1000
  +0.000 > udp(1000)
  ```

* The call to `recvfrom` after `sendto` is successful (same is true in case of FreeBSD) -
  ```
  +1.000 sendto(3, ..., 1000, 0, ..., ...) = 1000
  +0.000 > udp(1000)
  +1.000 < udp(1000)
  +0.000 recvfrom(3, ..., 1000, 0, ..., ...) = 1000
  ```

* The individual calls to `recvfrom` and `sendto` succeed (`recvfrom` fails in FreeBSD) -
  ```
  +1.000 < udp(1000)
  +0.000 recvfrom(3, ..., 1000, 0, ..., ...) = 1000
  ```
  ```
  +1.000 sendto(3, ..., 1000, 0, ..., ...) = 1000
  +0.000 > udp(1000)
  ```

* The point to be noted is that the test `udp_bug.pkt` succeeds on linux ; does this imply that failure on FreeBSD can be accounted to the network stack implementation ?

**Comment by tuexen** [comment]
`udp_bug.pkt` is also working on FreeBSD. I think I fixed the issue but forgot to close the issue.

However
```
 0.000 socket(..., SOCK_DGRAM, IPPROTO_UDP) = 3
+0.000 bind(3, ..., ...) = 0
+1.000 < udp(1000)
+0.000 recvfrom(3, ..., 1000, 0, ..., ...) = 1000
+1.000 sendto(3, ..., 1000, 0, ..., ...) = 1000
+0.000 > udp(1000)
+1.000 close(3) = 0
```
is failing be cause the port number being used is wrong:
```
tcpdump: verbose output suppressed, use -v or -vv for full protocol decode
listening on tun0, link-type NULL (BSD loopback), capture size 262144 bytes
12:44:01.584262 IP 192.0.2.1.14096 > 192.168.0.1.8080: UDP, length 1000
12:44:02.584611 IP 192.168.0.1.8080 > 192.0.2.1.8080: UDP, length 1000
```
I'll look into it and ix it.

**Comment by shivrai** [comment]
On Mon, Jul 24, 2017 at 4:16 PM Michael Tüxen <notifications@github.com>
wrote:

> udp_bug.pkt is also working on FreeBSD. I think I fixed the issue but
> forgot to close the issue.
>
> I guess it wasn't working for me as I wasn't testing on FreeBSD Head.
Apologies for the false alarm.

> However
>
>  0.000 socket(..., SOCK_DGRAM, IPPROTO_UDP) = 3
> +0.000 bind(3, ..., ...) = 0
> +1.000 < udp(1000)
> +0.000 recvfrom(3, ..., 1000, 0, ..., ...) = 1000
> +1.000 sendto(3, ..., 1000, 0, ..., ...) = 1000
> +0.000 > udp(1000)
> +1.000 close(3) = 0
>
> is failing be cause the port number being used is wrong:
>
> tcpdump: verbose output suppressed, use -v or -vv for full protocol decode
> listening on tun0, link-type NULL (BSD loopback), capture size 262144 bytes
> 12:44:01.584262 IP 192.0.2.1.14096 > 192.168.0.1.8080: UDP, length 1000
> 12:44:02.584611 IP 192.168.0.1.8080 > 192.0.2.1.8080: UDP, length 1000
>
> I'll look into it and ix it.
>
Interesting!

**Comment by tuexen** [comment]
The fix related to `udp_bug.pkt` was in `packetdrill`, not in the UDP stack. If I remember it correctly, it was using `0` as the port number, not the expected one. So it should not matter whether you are using FreeBSD head or an earlier version. I'm not aware of UDP related bugs (there where a couple of UDP-Lite related bugs).
